{
  "id": "automations",
  "name": "AI Agent",
  "description": "AI Agent: the rail of 18 per-scope sources beside the selected source's page — the Default rules and the custom rules, all 15 setting types, inheritance and compare, drafts for prompts and lists, real pickers for Instagram media, Facebook posts, Meta ads, teammates and attributes, duplicate / copy-to / delete with restore — the bot's AI model on the Default · All channels page, and an always-open Test panel that runs the preview chat pinned to the source's Default or one rule. Live via the fan-out subscription, ⌘K, keyboard, undo.",
  "status": "ready",
  "requires": [],
  "recommends": [
    "knowledge-base",
    "livechat",
    "bookings"
  ],
  "skill": {
    "installAs": "chatfuel-automations"
  },
  "app": {
    "env": [
      {
        "name": "CHATFUEL_TOKEN",
        "secret": true
      },
      {
        "name": "VITE_CHATFUEL_WORKSPACE_ID",
        "resolve": "workspacePick"
      },
      {
        "name": "CHATFUEL_API_BASE",
        "default": "https://panel.chatfuel.com"
      }
    ],
    "embed": {
      "roots": [
        "src/modules/automations"
      ],
      "entryComponent": "AutomationsApp",
      "playbook": "playbooks/embed.md"
    }
  },
  "permissions": [
    {
      "object": "Ai",
      "action": "View",
      "requiredFor": "reading automations, channels, team, attributes and the knowledge-base facts"
    },
    {
      "object": "Ai",
      "action": "Edit",
      "requiredFor": "every write, the composites (duplicate, copy, every rule on / off) and the test chat (managers cannot test)"
    },
    {
      "object": "Configure",
      "action": "Edit",
      "requiredFor": "changing the AI model the bot answers with, a bot setting rather than an AI one"
    }
  ]
}
